<?xml version="1.0" encoding="UTF-8"?>
<!DOCTYPE component SYSTEM "../misc/component.dtd" [
<!ENTITY standard_uicomponent_attributes		SYSTEM "../entities/standard_uicomponent_attributes.xml">
<!ENTITY output_component_attributes			SYSTEM "../entities/output_component_attributes.xml">
<!ENTITY input_component_attributes				SYSTEM "../entities/input_component_attributes.xml">
<!ENTITY command_component_attributes			SYSTEM "../entities/command_component_attributes.xml">
<!ENTITY widget_var_attribute					SYSTEM "../entities/widget_var_attribute.xml">
<!ENTITY html_command_button_attributes			SYSTEM "../entities/html_command_button_attributes.xml">
]>
<component>
	<tag>commandLink</tag>
	<tagClass>org.primefaces.component.commandlink.CommandLinkTag</tagClass>
	<componentClass>org.primefaces.component.commandlink.CommandLink</componentClass>
	<componentType>org.primefaces.component.CommandLink</componentType>
	<componentFamily>org.primefaces.component</componentFamily>
	<rendererType>org.primefaces.component.CommandLinkRenderer</rendererType>
	<rendererClass>org.primefaces.component.commandlink.CommandLinkRenderer</rendererClass>
	<parent>javax.faces.component.html.HtmlCommandLink</parent>
	<attributes>
		&command_component_attributes;
		<attribute>
			<name>update</name>
			<required>false</required>
			<type>java.lang.String</type>
			<description>
				Client side id of the component(s) to be updated after async partial submit request.
			</description>
		</attribute>
		<attribute>
			<name>onstart</name>
			<required>false</required>
			<type>java.lang.String</type>
			<description>
				Javascript event to be called before ajax request begins.
			</description>
		</attribute>
		<attribute>
			<name>oncomplete</name>
			<required>false</required>
			<type>java.lang.String</type>
			<description>
				Javascript event to be called when ajax request is completed.
			</description>
		</attribute>
		<attribute>
			<name>accesskey</name>
			<required>false</required>
			<type>java.lang.String</type>
			<ignoreInComponent>true</ignoreInComponent>
			<description>
				Html accesskey attribute for anchor.
			</description>
		</attribute>
		<attribute>
			<name>charset</name>
			<required>false</required>
			<type>java.lang.String</type>
			<ignoreInComponent>true</ignoreInComponent>
			<description>
				Html chartset attribute for anchor.
			</description>
		</attribute>
		<attribute>
			<name>coords</name>
			<required>false</required>
			<type>java.lang.String</type>
			<ignoreInComponent>true</ignoreInComponent>
			<description>
				Html coords attribute for anchor.
			</description>
		</attribute>
		<attribute>
			<name>dir</name>
			<required>false</required>
			<type>java.lang.String</type>
			<ignoreInComponent>true</ignoreInComponent>
			<description>
				Direction of the text displayed
			</description>
		</attribute>
		<attribute>
			<name>disabled</name>
			<required>false</required>
			<defaultValue>false</defaultValue>
			<type>java.lang.Boolean</type>
			<ignoreInComponent>true</ignoreInComponent>
			<description>
				Flag to disable the link.
			</description>
		</attribute>
		<attribute>
			<name>hreflang</name>
			<required>false</required>
			<type>java.lang.String</type>
			<ignoreInComponent>true</ignoreInComponent>
			<description>
				Html hreflang attribute for anchor.
			</description>
		</attribute>
		<attribute>
			<name>rel</name>
			<required>false</required>
			<type>java.lang.String</type>
			<ignoreInComponent>true</ignoreInComponent>
			<description>
				Html rel attribute for anchor.
			</description>
		</attribute>
		<attribute>
			<name>rev</name>
			<required>false</required>
			<type>java.lang.String</type>
			<ignoreInComponent>true</ignoreInComponent>
			<description>
				Html rev attribute for anchor.
			</description>
		</attribute>
		<attribute>
			<name>shape</name>
			<required>false</required>
			<type>java.lang.String</type>
			<ignoreInComponent>true</ignoreInComponent>
			<description>
				Html shape attribute for anchor.
			</description>
		</attribute>
		<attribute>
			<name>tabindex</name>
			<required>false</required>
			<type>java.lang.String</type>
			<ignoreInComponent>true</ignoreInComponent>
			<description>
				Html tabindex attribute for anchor.
			</description>
		</attribute>
		<attribute>
			<name>target</name>
			<required>false</required>
			<type>java.lang.String</type>
			<ignoreInComponent>true</ignoreInComponent>
			<description>
				Html target attribute for anchor.
			</description>
		</attribute>
		<attribute>
			<name>title</name>
			<required>false</required>
			<type>java.lang.String</type>
			<ignoreInComponent>true</ignoreInComponent>
			<description>
				Html title attribute for anchor.
			</description>
		</attribute>
		<attribute>
			<name>type</name>
			<required>false</required>
			<type>java.lang.String</type>
			<ignoreInComponent>true</ignoreInComponent>
			<description>
				Html type attribute for anchor.
			</description>
		</attribute>
		<attribute>
			<name>style</name>
			<required>false</required>
			<type>java.lang.String</type>
			<ignoreInComponent>true</ignoreInComponent>
			<description>
				Style to apply to the anchor element.
			</description>
		</attribute>
		<attribute>
			<name>styleClass</name>
			<required>false</required>
			<type>java.lang.String</type>
			<ignoreInComponent>true</ignoreInComponent>
			<description>
				Style class to apply to the anchor element.
			</description>
		</attribute>
		<attribute>
			<name>onblur</name>
			<required>false</required>
			<type>java.lang.String</type>
			<ignoreInComponent>true</ignoreInComponent>
			<description>
				 onblur dom event handler
			</description>
		</attribute>
		<attribute>
			<name>onclick</name>
			<required>false</required>
			<type>java.lang.String</type>
			<ignoreInComponent>true</ignoreInComponent>
			<description>
				 onclick dom event handler
			</description>
		</attribute>
		<attribute>
			<name>ondblclick</name>
			<required>false</required>
			<type>java.lang.String</type>
			<ignoreInComponent>true</ignoreInComponent>
			<description>
				 ondblclick dom event handler
			</description>
		</attribute>
		<attribute>
			<name>onfocus</name>
			<required>false</required>
			<type>java.lang.String</type>
			<ignoreInComponent>true</ignoreInComponent>
			<description>
				 onfocus dom event handler
			</description>
		</attribute>
		<attribute>
			<name>onkeydown</name>
			<required>false</required>
			<type>java.lang.String</type>
			<ignoreInComponent>true</ignoreInComponent>
			<description>
				 onkeydown dom event handler
			</description>
		</attribute>
		<attribute>
			<name>onkeypress</name>
			<required>false</required>
			<type>java.lang.String</type>
			<ignoreInComponent>true</ignoreInComponent>
			<description>
				 onkeypress dom event handler
			</description>
		</attribute>
		<attribute>
			<name>onkeyup</name>
			<required>false</required>
			<type>java.lang.String</type>
			<ignoreInComponent>true</ignoreInComponent>
			<description>
				 onkeyup dom event handler
			</description>
		</attribute>
		<attribute>
			<name>onmousedown</name>
			<required>false</required>
			<type>java.lang.String</type>
			<ignoreInComponent>true</ignoreInComponent>
			<description>
				 onmousedown dom event handler
			</description>
		</attribute>
		<attribute>
			<name>onmousemove</name>
			<required>false</required>
			<type>java.lang.String</type>
			<ignoreInComponent>true</ignoreInComponent>
			<description>
				 onmousemove dom event handler
			</description>
		</attribute>
		<attribute>
			<name>onmouseout</name>
			<required>false</required>
			<type>java.lang.String</type>
			<ignoreInComponent>true</ignoreInComponent>
			<description>
				 onmouseout dom event handler
			</description>
		</attribute>
		<attribute>
			<name>onmouseover</name>
			<required>false</required>
			<type>java.lang.String</type>
			<ignoreInComponent>true</ignoreInComponent>
			<description>
				 onmouseover dom event handler
			</description>
		</attribute>
		<attribute>
			<name>onmouseup</name>
			<required>false</required>
			<type>java.lang.String</type>
			<ignoreInComponent>true</ignoreInComponent>
			<description>
				 onmouseup dom event handler
			</description>
		</attribute>
	</attributes>
	<resources>
		<resource>
			<name>/yui/utilities/utilities.js</name>
		</resource>
		<resource>
			<name>/jquery/jquery.js</name>
		</resource>
		<resource>
			<name>/primefaces/ajax/ajax.js</name>
		</resource>
	</resources>
</component>