<?xml version="1.0" encoding="UTF-8"?>
<!DOCTYPE component SYSTEM "../misc/component.dtd" [
<!ENTITY standard_uicomponent_attributes		SYSTEM "../entities/standard_uicomponent_attributes.xml">
<!ENTITY widget_var_attribute					SYSTEM "../entities/widget_var_attribute.xml">
<!ENTITY output_component_attributes			SYSTEM "../entities/output_component_attributes.xml">
]>
<component>
	<tag>hotkey</tag>
	<tagClass>org.primefaces.component.hotkey.HotkeyTag</tagClass>
	<componentClass>org.primefaces.component.hotkey.Hotkey</componentClass>
	<componentType>org.primefaces.component.Hotkey</componentType>
	<componentFamily>org.primefaces.component</componentFamily>
	<rendererType>org.primefaces.component.HotkeyRenderer</rendererType>
	<rendererClass>org.primefaces.component.hotkey.HotkeyRenderer</rendererClass>
	<parent>javax.faces.component.UICommand</parent>
	<attributes>
		&standard_uicomponent_attributes;
		<attribute>
			<name>actionListener</name>
			<required>false</required>
			<type>javax.faces.event.ActionListener</type>
			<method-signature>void actionListener(javax.faces.event.ActionEvent)</method-signature>
			<ignoreInComponent>true</ignoreInComponent>
		</attribute>
		<attribute>
			<name>action</name>
			<required>false</required>
			<type>javax.el.MethodExpression</type>
			<method-signature>java.lang.Object action()</method-signature>
			<ignoreInComponent>true</ignoreInComponent>
		</attribute>
		<attribute>
			<name>immediate</name>
			<required>false</required>
			<type>java.lang.Boolean</type>
			<defaultValue>false</defaultValue>
			<ignoreInComponent>true</ignoreInComponent>
		</attribute>
		<attribute>
			<name>bind</name>
			<required>true</required>
			<type>java.lang.String</type>
			<description>The key binding.</description>
		</attribute>
		<attribute>
			<name>update</name>
			<required>false</required>
			<type>java.lang.String</type>
			<description>
				Client side id of the component(s) to be updated after async partial submit request.
			</description>
		</attribute>
		<attribute>
			<name>process</name>
			<required>false</required>
			<type>java.lang.String</type>
			<description>
				Comma seperated list of clientIds that will be processed partially in JSF lifecycle instead of the whole component tree.
			</description>
		</attribute>
		<attribute>
			<name>handler</name>
			<required>false</required>
			<type>java.lang.String</type>
			<description>The javascript event which will be performed when there is a event with the specific </description>
		</attribute>
		<attribute>
			<name>onstart</name>
			<required>false</required>
			<type>java.lang.String</type>
			<description>
				Javascript event handler to be called before ajax request begins.
			</description>
		</attribute>
		<attribute>
			<name>oncomplete</name>
			<required>false</required>
			<type>java.lang.String</type>
			<description>
				Javascript event handler to be called when ajax request is completed.
			</description>
		</attribute>
		<attribute>
			<name>onerror</name>
			<required>false</required>
			<type>java.lang.String</type>
			<description>
				Javascript event handler to be called when ajax request fails.
			</description>
		</attribute>
		<attribute>
			<name>onsuccess</name>
			<required>false</required>
			<type>java.lang.String</type>
			<description>
				Javascript event handler to be called when ajax request succeeds.
			</description>
		</attribute>
		<attribute>
			<name>global</name>
			<required>false</required>
			<type>java.lang.Boolean</type>
			<defaultValue>true</defaultValue>
			<description>
				Global ajax requests are listened by ajaxStatus component, setting global to false will not trigger ajaxStatus.
			</description>
		</attribute>
		<attribute>
			<name>async</name>
			<required>false</required>
			<type>java.lang.Boolean</type>
			<defaultValue>false</defaultValue>
			<description>
				When set to true, ajax requests will not be queued.
			</description>
		</attribute>
	</attributes>
	<resources>
		<resource>
			<name>/yui/utilities/utilities.js</name>
		</resource>
		<resource>
			<name>/jquery/jquery.js</name>
		</resource>
		<resource>
			<name>/jquery/plugins/hotkey/jquery.hotkeys-0.7.9.min.js</name>
		</resource>
		<resource>
			<name>/primefaces/core/core.js</name>
		</resource>
	</resources>
</component>
