<?xml version="1.0" encoding="UTF-8"?>
<!DOCTYPE component SYSTEM "../misc/component.dtd" [
<!ENTITY standard_uicomponent_attributes		SYSTEM "../entities/standard_uicomponent_attributes.xml">
<!ENTITY data_component_attributes				SYSTEM "../entities/data_component_attributes.xml">
<!ENTITY widget_var_attribute					SYSTEM "../entities/widget_var_attribute.xml">
]>
<component>
	<tag>dataTable</tag>
	<tagClass>org.primefaces.component.datatable.DataTableTag</tagClass>
	<componentClass>org.primefaces.component.datatable.DataTable</componentClass>
	<componentType>org.primefaces.component.DataTable</componentType>
	<componentFamily>org.primefaces.component</componentFamily>
	<rendererType>org.primefaces.component.DataTableRenderer</rendererType>
	<rendererClass>org.primefaces.component.datatable.DataTableRenderer</rendererClass>
	<parent>javax.faces.component.UIData</parent>
	<ajaxComponent>true</ajaxComponent>
	<attributes>
		&data_component_attributes;
		&widget_var_attribute;
		<attribute>
			<name>paginator</name>
			<required>false</required>
			<type>java.lang.Boolean</type>
			<defaultValue>false</defaultValue>
			<description>Enables paginator, default value is false</description>
		</attribute>
		<attribute>
			<name>paginatorTemplate</name>
			<required>false</required>
			<type>java.lang.String</type>
			<description>Template for the paginator layout, default value is "{FirstPageLink} {PreviousPageLink} {PageLinks} {NextPageLink} {LastPageLink}"</description>
		</attribute>
		<attribute>
			<name>rowsPerPageTemplate</name>
			<required>false</required>
			<type>java.lang.String</type>
			<description>Template for the rowsPerPage dropdown, default value is "25,50,100"</description>
		</attribute>
		<attribute>
			<name>scrollable</name>
			<required>false</required>
			<type>java.lang.Boolean</type>
			<defaultValue>false</defaultValue>
			<description>Controls scrolling, default value is false</description>
		</attribute>
		<attribute>
			<name>width</name>
			<required>false</required>
			<type>java.lang.String</type>
			<description>
				Width of a scrollable datatable
			</description>
		</attribute>
		<attribute>
			<name>height</name>
			<required>false</required>
			<type>java.lang.String</type>
			<description>
				Height of a scrollable datatable
			</description>
		</attribute>
		<attribute>
			<name>firstPageLinkLabel</name>
			<required>false</required>
			<type>java.lang.String</type>
			<description>
				Label of the first link paginator
			</description>
		</attribute>
		<attribute>
			<name>previousPageLinkLabel</name>
			<required>false</required>
			<type>java.lang.String</type>
			<description>
				Label of the previous link paginator
			</description>
		</attribute>
		<attribute>
			<name>nextPageLinkLabel</name>
			<required>false</required>
			<type>java.lang.String</type>
			<description>
				Label of the next link paginator
			</description>
		</attribute>
		<attribute>
			<name>lastPageLinkLabel</name>
			<required>false</required>
			<type>java.lang.String</type>
			<description>
				Label of the last link paginator
			</description>
		</attribute>
		<attribute>
			<name>selectionMode</name>
			<required>false</required>
			<type>java.lang.String</type>
			<description>
				Type for row click selection, can be 'multiple' or 'single'.
			</description>
		</attribute>
		<attribute>
			<name>selection</name>
			<required>false</required>
			<type>java.lang.Object</type>
			<description>
				An object array that'll be used to assign the selected data.
			</description>
		</attribute>
		<attribute>
			<name>dynamic</name>
			<required>false</required>
			<type>java.lang.Boolean</type>
			<defaultValue>false</defaultValue>
			<description>
				When set to true sorting and paging will be done on server via ajax, default is false meaning sorting-paging is done on client side.
			</description>
		</attribute>
		<attribute>
			<name>lazy</name>
			<required>false</required>
			<type>java.lang.Boolean</type>
			<defaultValue>false</defaultValue>
			<description>
				Controls lazy loading.
			</description>
		</attribute>
		<attribute>
			<name>rowIndexVar</name>
			<required>false</required>
			<type>java.lang.String</type>
			<description>
				Variable name referring to the rowIndex being processed.
			</description>
		</attribute>
		<attribute>
			<name>paginatorPosition</name>
			<required>false</required>
			<type>java.lang.String</type>
			<defaultValue>both</defaultValue>
			<description>
				Position of the paginator, valid values are "both","top","bottom".
			</description>
		</attribute>
		<attribute>
			<name>emptyMessage</name>
			<required>false</required>
			<type>java.lang.String</type>
			<description>
				Message to be shown when there're no records to display.
			</description>
		</attribute>
		<attribute>
			<name>errorMessage</name>
			<required>false</required>
			<type>java.lang.String</type>
			<description>
				Message to be shown when there's an error loading the data.
			</description>
		</attribute>
		<attribute>
			<name>loadingMessage</name>
			<required>false</required>
			<type>java.lang.String</type>
			<description>
				Message to be shown when loading the data with ajax.
			</description>
		</attribute>
		<attribute>
			<name>sortAscMessage</name>
			<required>false</required>
			<type>java.lang.String</type>
			<description>
				Message to be shown to sort a column data in ascending order.
			</description>
		</attribute>
		<attribute>
			<name>sortDescMessage</name>
			<required>false</required>
			<type>java.lang.String</type>
			<description>
				Message to be shown to sort a column data in descending order.
			</description>
		</attribute>
		<attribute>
			<name>update</name>
			<required>false</required>
			<type>java.lang.String</type>
			<description>
				Client side id of the component(s) to be updated after ajax row selection.
			</description>
		</attribute>
		<attribute>
			<name>style</name>
			<required>false</required>
			<type>java.lang.String</type>
			<description>Style of the main container element of table.</description>
		</attribute>
		<attribute>
			<name>styleClass</name>
			<required>false</required>
			<type>java.lang.String</type>
			<description>StyleClass of the main container element of table.</description>
		</attribute>
		<attribute>
			<name>onselectStart</name>
			<required>false</required>
			<type>java.lang.String</type>
			<description>
				Javascript event handler to be called before ajax request for instant ajax row selection request begins.
			</description>
		</attribute>
		<attribute>
			<name>onselectComplete</name>
			<required>false</required>
			<type>java.lang.String</type>
			<description>
				Javascript event handler to be called after ajax request for instant ajax row selection request is completed.
			</description>
		</attribute>
		<attribute>
			<name>dblClickSelect</name>
			<required>false</required>
			<type>java.lang.Boolean</type>
			<defaultValue>false</defaultValue>
			<description>
				By default single click triggers row selection feature, setting dblClickSelect enabled double click requirement for row selection.
			</description>
		</attribute>
		<attribute>
			<name>page</name>
			<required>false</required>
			<type>java.lang.Integer</type>
			<defaultValue>1</defaultValue>
			<description>Index of the current page, first page is 1.</description>
		</attribute>
		<attribute>
			<name>pageLinks</name>
			<required>false</required>
			<type>java.lang.Integer</type>
			<defaultValue>10</defaultValue>
			<description>Number of pageLinks to display when paginator is enabled, defaults to 10.</description>
		</attribute>
	</attributes>
	<resources>
		<resource>
			<name>/yui/paginator/assets/skins/sam/paginator.css</name>
		</resource>
		<resource>
			<name>/yui/datatable/assets/skins/sam/datatable.css</name>
		</resource>
		<resource>
			<name>/yui/utilities/utilities.js</name>
		</resource>
		<resource>
			<name>/yui/json/json-min.js</name>
		</resource>
		<resource>
			<name>/yui/datasource/datasource-min.js</name>
		</resource>
		<resource>
			<name>/yui/paginator/paginator-min.js</name>
		</resource>
		<resource>
			<name>/yui/datatable/datatable-min.js</name>
		</resource>
		<resource>
			<name>/jquery/jquery.js</name>
		</resource>
		<resource>
			<name>/primefaces/core/core.js</name>
		</resource>
		<resource>
			<name>/primefaces/datatable/datatable.js</name>
		</resource>
	</resources>
</component>