<?xml version="1.0" encoding="UTF-8"?>
<!DOCTYPE component SYSTEM "../misc/component.dtd" [
<!ENTITY standard_uicomponent_attributes		SYSTEM "../entities/standard_uicomponent_attributes.xml">
<!ENTITY output_component_attributes			SYSTEM "../entities/output_component_attributes.xml">
<!ENTITY input_component_attributes				SYSTEM "../entities/input_component_attributes.xml">
<!ENTITY html_input_textarea_attributes			SYSTEM "../entities/html_input_textarea_attributes.xml">
<!ENTITY widget_var_attribute					SYSTEM "../entities/widget_var_attribute.xml">
]>
<component>
	<tag>resource</tag>
	<tagClass>org.primefaces.component.resource.ResourceTag</tagClass>
	<componentClass>org.primefaces.component.resource.Resource</componentClass>
	<componentType>org.primefaces.component.Resource</componentType>
	<componentFamily>org.primefaces.component</componentFamily>
	<rendererType>org.primefaces.component.ResourceRenderer</rendererType>
	<rendererClass>org.primefaces.component.resource.ResourceRenderer</rendererClass>
	<parent>javax.faces.component.UIComponentBase</parent>
	<attributes>
		&standard_ui_component_attributes;
		<attribute>
			<name>name</name>
			<required>false</required>
			<type>java.lang.String</type>
			<description>Path of the resource to be exluded.</description>
		</attribute>
	</attributes>
</component>