<?xml version="1.0" encoding="UTF-8"?>
<!DOCTYPE component SYSTEM "../misc/component.dtd" [
<!ENTITY standard_uicomponent_attributes		SYSTEM "../entities/standard_uicomponent_attributes.xml">
<!ENTITY widget_var_attribute					SYSTEM "../entities/widget_var_attribute.xml">
]>
<component>
	<tag>confirmDialog</tag>
	<tagClass>org.primefaces.component.confirmdialog.ConfirmDialogTag</tagClass>
	<componentClass>org.primefaces.component.confirmdialog.ConfirmDialog</componentClass>
	<componentType>org.primefaces.component.ConfirmDialog</componentType>
	<componentFamily>org.primefaces.component</componentFamily>
	<rendererType>org.primefaces.component.ConfirmDialogRenderer</rendererType>
	<rendererClass>org.primefaces.component.confirmdialog.ConfirmDialogRenderer</rendererClass>
	<parent>javax.faces.component.UIPanel</parent>
	<attributes>
		&standard_uicomponent_attributes;
		&widget_var_attribute;
		<attribute>
			<name>message</name>
			<required>true</required>
			<type>java.lang.String</type>
			<description>The text displayed in the dialog</description>
		</attribute>
		<attribute>
			<name>header</name>
			<required>false</required>
			<type>java.lang.String</type>
			<description>The text displayed in the dialog's header part</description>
		</attribute>
		<attribute>
			<name>severity</name>
			<required>false</required>
			<type>java.lang.String</type>
			<defaultValue>alert</defaultValue>
			<description>Icon for the severity of the message</description>
		</attribute>
		<attribute>
			<name>draggable</name>
			<required>false</required>
			<type>java.lang.Boolean</type>
			<defaultValue>true</defaultValue>
			<description>
				Boolean value whether to allow the user to drag the Panel using its header.
			</description>
		</attribute>
		<attribute>
			<name>modal</name>
			<required>false</required>
			<type>java.lang.Boolean</type>
			<defaultValue>false</defaultValue>
			<description>
				Boolean value that specifies whether the document should be
				shielded with a partially transparent mask to require the user
				to close the Panel before being able to activate any elements in
				the document.
			</description>
		</attribute>
		<attribute>
			<name>width</name>
			<required>false</required>
			<type>java.lang.Integer</type>
			<defaultValue>300</defaultValue>
			<description>Width of the element in pixels</description>
		</attribute>
		<attribute>
			<name>height</name>
			<required>false</required>
			<type>java.lang.Integer</type>
			<defaultValue>java.lang.Integer.MIN_VALUE</defaultValue>
			<description>Height of the element in pixels</description>
		</attribute>
		<attribute>
			<name>zindex</name>
			<required>false</required>
			<type>java.lang.Integer</type>
			<defaultValue>1000</defaultValue>
			<description>zindex property to control overlapping with other elements</description>
		</attribute>
		<attribute>
			<name>styleClass</name>
			<required>false</required>
			<type>java.lang.String</type>
			<description>Style class of the main container of dialog.</description>
		</attribute>
		<attribute>
			<name>showEffect</name>
			<required>false</required>
			<type>java.lang.String</type>
			<description>Effect to use when showing the dialog</description>
		</attribute>
		<attribute>
			<name>hideEffect</name>
			<required>false</required>
			<type>java.lang.String</type>
			<description>Effect to use when hiding the dialog</description>
		</attribute>
		<attribute>
			<name>position</name>
			<required>false</required>
			<type>java.lang.String</type>
			<description>Defines where the dialog should be displayed</description>
		</attribute>
		<attribute>
			<name>closeOnEscape</name>
			<required>false</required>
			<type>java.lang.Boolean</type>
			<defaultValue>true</defaultValue>
			<description>Defines if dialog should be closed when escape key is pressed</description>
		</attribute>
		<attribute>
			<name>closable</name>
			<required>false</required>
			<type>java.lang.Boolean</type>
			<defaultValue>true</defaultValue>
			<description>Defines if close icon should be displayed or not</description>
		</attribute>
	</attributes>
	<resources>
		<resource>
			<name>/jquery/plugins/ui/jquery.ui.dialog.css</name>
		</resource>
		<resource>
			<name>/jquery/jquery.js</name>
		</resource>
		<resource>
			<name>/jquery/plugins/ui/jquery-ui.custom.js</name>
		</resource>	
		<resource>
			<name>/primefaces/core/core.js</name>
		</resource>
		<resource>
			<name>/primefaces/confirmdialog/confirmdialog.js</name>
		</resource>
	</resources>
</component>